{"ch":"ctlr/mac-01/viewer-device-01","class":"ctl","ct":"Y+Qqji8cDIvdi2wpY/rSEE2xMUKp9Fw5S0EVMIWc4cWgyud0e4HcbER1NYkkyLwHWAoq85LosG+1Oe3txMXmAGEM9GahgT+a4cKmjxWg+asDMXR3Hg37GyBPujneFLjPfmscAVqGia3Tpjoq1ElajbUywJNQeQHJYwybqD/06JvWdrJsSlEyLE5uokAn3loq8A+NPdEo79JiYW6IZu13NZZ/el6umgk/00m29Ko6sqijT4Ukd/CIYyA2o0FKgJWbnsFyN/JBNKe6cYOfiqt1Si2IqHxYQAklfGjsfEE=","key_id":"rk-zF3jN8rQ4Wm2pV6sT0uYxA","nonce":"AAAAAAAAAAAAAAAI","sender":"mac-01","seq":912,"sig":"FtpJZt6myTWkXL2zCGwkeZq2OYiVtSQFMvnltYEJpXFxtuZoeK9VpFBD7P7FKmDQXlk6joWtB0Elk4AhOaqWDg==","ts":1787817600456,"v":1}