{"ch":"ctl/mac-01","class":"ctl","ct":"SYSUFYGzg5UKK6schvAC72o91WEBOvmDYFhDDNom2vC8u5Q7wQwamsUE3jveTolLqWpDLIcw1uCY2mDKQlMwUhEMisfuQBUwahEhAgLG/Q7TTuTJ2sc+uTAaXUqJRS+w3FKVpFvUygZkAwtospdrBHnlKKqFWQGFEIQ1NiUBS4CAmt//7y3/nY9iSih4vWqXqAJFnyIAOvnV6sYmLRzFhW8USiqIsOyn72Ymx6+1E+enVRLz5JBjv/EHynSLoP6b38G2cBQMwH/6CShAcvIew33/xeapbTdqT2eZJUE+k0d5L0kM1/QWpDAUqqD1O7Ar34xUX5cuRMbXaoywD0H8P+nJc8UsjUtkmve3EiCB6o0CkLOTCEXSkSSmi9tHHCBiO2Re+k3Viw==","key_id":"ms-1","nonce":"AAAAAAAAAAAAAAAH","sender":"viewer-device-01","seq":411,"sig":"QBKVpkGRs711T3yiB5rBTnd4XbJScoCU7FZ5/W3uZUkQSseV1bTCRRBPJC2pagiX2OgNUz4qFTxRcCgNzlLCCA==","ts":1787817600000,"v":1}